A2: 755 | B2: =A1/$A$3 -> 0.47305764411027568 | C2: Code
A3: 1596 | B3: =A2/$A$3 -> 1 | C3: Data
A4: =SUM(A2:A2) -> 1596 | C4: total
A5: Data breakdown
A6: 693 | B6: =A6/$A$12 -> 0.43421052631578949 | C6: General Locale data
A7: 388 | B7: =A7/$A$12 -> 0.24310776942355888 | C7: Collation data (inc UCA rules)
A8: 228 | B8: =A8/$A$12 -> 0.14285714285714285 | C8: Unicode data (props, names,...
A9: 178 | B9: =A9/$A$12 -> 0.11152882205513784 | C9: Translit data
A10: 54 | B10: =A10/$A$12 -> 3.3834586466165412E-2 | C10: Thai break
A11: 55 | B11: =A11/$A$12 -> 3.4461152882205512E-2 | C11: Thai dict
A12: =SUM(A6:A11) -> 1596 | C12: total

A5: =A10 -> 1363.9680000000001 | B5: =A1/$A$3 -> 0.14008392086428464 | C5: Code
A6: =A22 -> 8372.8240000000005 | B6: =A2/$A$3 -> 0.85991607913571533 | C6: Data
A7: =SUM(A1:A2) -> 9736.7920000000013 | C7: total
A8: Code breakdown
A9: 585.72799999999995 | B9: =A7/$A$10 -> 0.42942942942942935 | C9: Common library (Unicode strings and properties, conversion, resource bundles, break iteration)
A10: 688.12800000000004 | B10: =A8/$A$10 -> 0.50450450450450446 | C10: I18N library (collation, transforms/transliteration, formatting/parsing, regex)
A11: 90.111999999999995 | B11: =A9/$A$10 -> 6.6066066066066062E-2 | C11: Layout library (text line layout)
A12: =SUM(A7:A9) -> 1363.9680000000001 | C12: total
A13: Data breakdown
A14: 4514.6480000000001 | B14: =A14/$A$22 -> 0.53920254384900479 | C14: Conversion (160 files, .cnv and alias table)
A15: 2413.0360000000001 | B15: =A15/$A$22 -> 0.28819858150607247 | C15: Locale data (244 files, includes calendar, formatting, collation data)
A16: 587.71600000000001 | B16: =A16/$A$22 -> 7.0193282457627196E-2 | C16: Script transliteration (34 files)
A17: 346.63799999999998 | B17: =A17/$A$22 -> 4.1400368621148605E-2 | C17: Unicode (4 files - properties, property names, character names, normalization)
A18: 249.76 | B18: =A18/$A$22 -> 2.9829839967972571E-2 | C18: Text boundaries (7 files)
A19: 222.80600000000001 | B19: =A19/$A$22 -> 2.6610615486483413E-2 | C19: UCA collation (2 files)
A20: 22.571999999999999 | B20: =A20/$A$22 -> 2.6958646210645293E-3 | C20: IDNA (1 file)
A21: 15.648 | B21: =A21/$A$22 -> 1.8689034906263404E-3 | C21: Timezone data (1 file)
A22: =SUM(A14:A21) -> 8372.8240000000005 | C22: total